{"$id":"urn:hivehub:schema:ai-join-card:1","$schema":"https://json-schema.org/draft/2020-12/schema","additionalProperties":false,"properties":{"adapter_plan":{"oneOf":[{"additionalProperties":false,"properties":{"adapter_registration_address":{"pattern":"^urn:hivehub:sha256:[0-9a-f]{64}$","type":"string"},"effects":{"items":{"additionalProperties":false,"properties":{"description":{"maxLength":4096,"minLength":1,"type":"string"},"effect_id":{"maxLength":4096,"minLength":1,"type":"string"},"kind":{"enum":["authenticate","clone","execute","fetch","other","write"]},"locator":{"oneOf":[{"maxLength":4096,"minLength":1,"type":"string"},{"type":"null"}]},"requires_approval":{"const":true}},"required":["effect_id","kind","description","locator","requires_approval"],"type":"object"},"maxItems":256,"type":"array"},"kind":{"const":"adapter-plan"},"record_id":{"pattern":"^urn:hivehub:sha256:[0-9a-f]{64}$","type":"string"},"schema_version":{"const":1}},"required":["kind","schema_version","adapter_registration_address","record_id","effects"],"type":"object"},{"type":"null"}]},"card_id":{"pattern":"^urn:hivehub:sha256:[0-9a-f]{64}$","type":"string"},"expected_protocol_fingerprint":{"oneOf":[{"pattern":"^urn:hivehub:sha256:[0-9a-f]{64}$","type":"string"},{"type":"null"}]},"expected_record_id":{"oneOf":[{"pattern":"^urn:hivehub:sha256:[0-9a-f]{64}$","type":"string"},{"type":"null"}]},"issued_at":{"maxLength":4096,"minLength":1,"type":"string"},"kind":{"const":"ai-join-card"},"locator":{"maxLength":4096,"minLength":1,"type":"string"},"principal":{"additionalProperties":false,"properties":{"id":{"maxLength":4096,"minLength":1,"type":"string"},"kind":{"enum":["human","ai"]}},"required":["kind","id"],"type":"object"},"schema_version":{"const":1}},"required":["kind","schema_version","card_id","principal","locator","expected_record_id","expected_protocol_fingerprint","adapter_plan","issued_at"],"title":"ai-join-card","type":"object"}
