{"adapter_plan":null,"card_id":"urn:hivehub:sha256:096f389f6712c990fd6e0f8aedfa9b30192b3d288b3ccd877ab8eca16b7a5133","expected_protocol_fingerprint":null,"expected_record_id":null,"issued_at":"2026-09-18T23:29:19Z","kind":"ai-join-card","locator":"dial:sha256:c37cc47826a1c776ccb42b16ad41e3d89977d4c4530a4e63f0da23d2a8c81b5e","principal":{"id":"hive-hub-camera","kind":"ai"},"schema_version":1}
