{"adapter_plan":null,"card_id":"urn:hivehub:sha256:80fd10fba53a7a10488b67a7bafa9cce3fe65438a6298952c04b0fa14c97ac9e","expected_protocol_fingerprint":null,"expected_record_id":null,"issued_at":"2026-09-18T23:29:19Z","kind":"ai-join-card","locator":"dial:sha256:9520e97015f272b6d4160256a36c33eb276fe9645f35a493f7fcb8bcf284310b","principal":{"id":"hive-hub-camera","kind":"ai"},"schema_version":1}
