{"adapter_plan":null,"card_id":"urn:hivehub:sha256:c810edf5c608231233fe1e7aca45b4b14060cb94d96d840283d1ba92365ea42a","expected_protocol_fingerprint":null,"expected_record_id":null,"issued_at":"2026-09-18T19:16:11Z","kind":"ai-join-card","locator":"dial:sha256:9302697cb9068ededacf36b8ad9197467dd9437589295f7350833c1358fceaf1","principal":{"id":"hive-hub-camera","kind":"ai"},"schema_version":1}
