{"adapter_plan":null,"card_id":"urn:hivehub:sha256:f626307ddc68a73df15721fc66d746790022c8f51e7bb3d29fe3147c261f8af2","expected_protocol_fingerprint":null,"expected_record_id":null,"issued_at":"2026-09-18T23:29:19Z","kind":"ai-join-card","locator":"dial:sha256:4c4106dbf3b4663ba3a49167b01b73f396b23e2d89a3ce2a8368d00a6ddffe8e","principal":{"id":"hive-hub-camera","kind":"ai"},"schema_version":1}
