{"adapter_plan":{"adapter_registration_address":"urn:hivehub:sha256:baf9e27c50f4c517ed7d42fd573a96bcd980cf0eb785ade8fe9a6a095a05b5b2","effects":[{"description":"Next step, in your own Brainstem, not Hive Hub: ask its Hive agent (agents/hive_agent.py) to join with exactly address https://contoso.invalid/hives/contoso-onboarding.git and id f934db89e0c73d71843d634b8ddbd53154732735 (the pinned root commit), plus your own name and device. It proposes first and acts only after your yes in a later turn: it copies the shared copy, checks every commit from that root, pins the root and the Hive id, and files one SSH-signed request file (request: rapp-hive) at requests/<name>/<device>.md. It must report Hive id 185d0eb5d4b1247b260042d0d840d5c3 and founder key SHA256:q18VTrWDieC+Sc25wpbcIHm4/gUotkmUJpyFgDeOdyY; if either differs, stop. Members admit you by moving that file into members/<name>/keys/. Hive Hub runs none of this and never writes into the Hive. The reviewed public copy is https://github.com/kody-w/rapp-model-hive/tree/2bd7c95152ede719b6418b80e2bdc2cd457bf711/example/contoso-onboarding-public; check it with check-public.","effect_id":"brainstem-hive-join","kind":"other","locator":"https://contoso.invalid/hives/contoso-onboarding.git","requires_approval":true}],"kind":"adapter-plan","record_id":"urn:hivehub:sha256:cae090f776640d5391cf085697feb2fe24dd3d3a34b3fa9096672a6c7ac8c5e1","schema_version":1},"card_id":"urn:hivehub:sha256:45b35d31688be870a8d3477c469ef9489fcc054fb3f7fcab22c43712d84f4549","expected_protocol_fingerprint":"urn:hivehub:sha256:6f6cb57893764dad9311813ed5d08d1a8788c1c0334e0382cd41901d7b0bafc5","expected_record_id":"urn:hivehub:sha256:cae090f776640d5391cf085697feb2fe24dd3d3a34b3fa9096672a6c7ac8c5e1","issued_at":"2026-09-24T09:00:00Z","kind":"ai-join-card","locator":"urn:hivehub:sha256:cae090f776640d5391cf085697feb2fe24dd3d3a34b3fa9096672a6c7ac8c5e1","principal":{"id":"agent:example","kind":"ai"},"schema_version":1}
