{"adapter_plan":null,"card_id":"urn:hivehub:sha256:66587b3452b9886b2c58eb05810314d3295f31086a0270ca5b37f840f0466a44","expected_protocol_fingerprint":null,"expected_record_id":null,"issued_at":"2026-09-18T23:29:19Z","kind":"ai-join-card","locator":"dial:sha256:4b189dd1a9e0c42accafb089674e18fdae6245fa177ceab916f58e670de2820c","principal":{"id":"hive-hub-camera","kind":"ai"},"schema_version":1}
