{"adapter_plan":null,"card_id":"urn:hivehub:sha256:167740bf1eeb971fa9ad443a0ba30975856047a4bd17fea70ae6595dce2c22a5","expected_protocol_fingerprint":null,"expected_record_id":null,"issued_at":"2026-09-18T23:29:19Z","kind":"ai-join-card","locator":"dial:sha256:aecc8c416d05a7a4f946d07977972f630f701d1c835721fd1166489f83b6611d","principal":{"id":"hive-hub-camera","kind":"ai"},"schema_version":1}
