{"adapter_plan":null,"card_id":"urn:hivehub:sha256:90fc0bc038da2393a5930cc15d11a81c3e950cd5f46036465f9995d14e1d7d9e","expected_protocol_fingerprint":null,"expected_record_id":null,"issued_at":"2026-09-18T23:29:19Z","kind":"ai-join-card","locator":"dial:sha256:ef2a7109f2f63f6c7d7dfd84c527f06fb87be9397f46a48ac1898572b242dade","principal":{"id":"hive-hub-camera","kind":"ai"},"schema_version":1}
