{"adapter_plan":null,"card_id":"urn:hivehub:sha256:1d0023330fbeec246d80f50835798ea3e9ad267d70ea781d5ab053389ef26515","expected_protocol_fingerprint":null,"expected_record_id":null,"issued_at":"2026-09-18T23:29:19Z","kind":"ai-join-card","locator":"dial:sha256:dcc14b2abe971518bd231100863e92bc635983a7d5788a692aec4639e712a65d","principal":{"id":"hive-hub-camera","kind":"ai"},"schema_version":1}
