{"adapter_plan":null,"card_id":"urn:hivehub:sha256:7dfe7271d5c666f0f733427c7e96f7e1e76b123daa6c8aabeac9b0d0c8380510","expected_protocol_fingerprint":null,"expected_record_id":null,"issued_at":"2026-09-18T23:29:19Z","kind":"ai-join-card","locator":"dial:sha256:c34d8b053797c946528924629554abda0d1b9d5498bab5b1fec5059e44249616","principal":{"id":"hive-hub-camera","kind":"ai"},"schema_version":1}
