{"adapter_plan":null,"card_id":"urn:hivehub:sha256:a8058917adbeaa37ca6e99be8cef5677232460faaa2c3680ce324a05f30c8fb4","expected_protocol_fingerprint":null,"expected_record_id":null,"issued_at":"2026-09-18T19:16:11Z","kind":"ai-join-card","locator":"dial:sha256:6b822d070281ee28b89c3c4209e5ba6e796a09ec5973da6e73324cee44127c32","principal":{"id":"hive-hub-camera","kind":"ai"},"schema_version":1}
