{"adapter_plan":null,"card_id":"urn:hivehub:sha256:7678863ab17649e0e149fcb4e25d1bd024adc687dbeac46e84939afb8f656c9c","expected_protocol_fingerprint":null,"expected_record_id":null,"issued_at":"2026-09-18T23:29:19Z","kind":"ai-join-card","locator":"dial:sha256:25e9761911f3fd3791458371ca3c7bb8945d221c56ee947bf6f96d76c08afd6d","principal":{"id":"hive-hub-camera","kind":"ai"},"schema_version":1}
