{"adapter_plan":null,"card_id":"urn:hivehub:sha256:55cfce673e0cf2c991ac8f5f1abf387361bc0f0b0cd7357c1898a1a43198b5e1","expected_protocol_fingerprint":null,"expected_record_id":null,"issued_at":"2026-09-18T23:29:19Z","kind":"ai-join-card","locator":"dial:sha256:96422842a8c4c5581ed5a4a91c67cbad7ae43245be2d3777e91956a7399644ec","principal":{"id":"hive-hub-camera","kind":"ai"},"schema_version":1}
