{"adapter_plan":null,"card_id":"urn:hivehub:sha256:70bc7e8da2cc2cb884ba28d2fbee7ecd327749f24c6ea84c9552dc6851351e0c","expected_protocol_fingerprint":null,"expected_record_id":null,"issued_at":"2026-09-18T23:29:19Z","kind":"ai-join-card","locator":"dial:sha256:4d3004c1c97d3a01c1fbdc92a2ec4b24993037ddf74d117e5cb827d2ee1a2078","principal":{"id":"hive-hub-camera","kind":"ai"},"schema_version":1}
