{"adapter_plan":null,"card_id":"urn:hivehub:sha256:62a613ff7fc31047e37201385f968f86e300d03f3f85a50a5a416386cc34b072","expected_protocol_fingerprint":null,"expected_record_id":null,"issued_at":"2026-09-18T23:29:19Z","kind":"ai-join-card","locator":"dial:sha256:f13e2a85e64e873c2fe74adcdb72255a3d4487f1380f54920e1aef8267bb8b0f","principal":{"id":"hive-hub-camera","kind":"ai"},"schema_version":1}
