{"adapter_plan":null,"card_id":"urn:hivehub:sha256:4bf46aa435b63b16202ef529ffdbbd8f54abd86e880aeeec9d3a55152332e586","expected_protocol_fingerprint":null,"expected_record_id":null,"issued_at":"2026-09-18T23:29:19Z","kind":"ai-join-card","locator":"dial:sha256:e93afe6084ea6d599c2dd40ef8e58973633df3ec243b81b35515d7503631d1bc","principal":{"id":"hive-hub-camera","kind":"ai"},"schema_version":1}
