{"adapter_plan":null,"card_id":"urn:hivehub:sha256:6f0732fec68cbdeb5a8862269be28fcd31fe9841babb8b999583b898e5497e90","expected_protocol_fingerprint":null,"expected_record_id":null,"issued_at":"2026-09-18T23:29:19Z","kind":"ai-join-card","locator":"dial:sha256:98315e0d647a0acb3068cbf86a1ddd480a655b35e1ff3f93643c4c56babad5f8","principal":{"id":"hive-hub-camera","kind":"ai"},"schema_version":1}
