{"adapter_plan":null,"card_id":"urn:hivehub:sha256:31fafac236f976e02f31146f0a9aa85265497cc1a104a51abeb6fb012a46bb38","expected_protocol_fingerprint":null,"expected_record_id":null,"issued_at":"2026-09-18T23:29:19Z","kind":"ai-join-card","locator":"dial:sha256:151a8ed3786e1bd1ab20a207722ea2370c2c9f7e85bc8d289dc919b61e53b300","principal":{"id":"hive-hub-camera","kind":"ai"},"schema_version":1}
