{"adapter_plan":null,"card_id":"urn:hivehub:sha256:c6037e2576dda1faff409e194e143ffc89543e21b57843ebc4e155776d0faa26","expected_protocol_fingerprint":null,"expected_record_id":null,"issued_at":"2026-09-18T19:16:11Z","kind":"ai-join-card","locator":"dial:sha256:6efe6390f51f67d1bca0169280ed8e091040563430186df4bb28ebff4298486c","principal":{"id":"hive-hub-camera","kind":"ai"},"schema_version":1}
