{"adapter_plan":null,"card_id":"urn:hivehub:sha256:a782ac15a2c54e010de1b28804ef12938c538b42405896385dbafebdeb254c36","expected_protocol_fingerprint":null,"expected_record_id":null,"issued_at":"2026-09-18T23:29:19Z","kind":"ai-join-card","locator":"dial:sha256:b01a0090d68d9fac8d27ce3efb737a05a11e19aa2450c08dd1768651ecd552d0","principal":{"id":"hive-hub-camera","kind":"ai"},"schema_version":1}
