{"adapter_plan":null,"card_id":"urn:hivehub:sha256:07ad757f9857e43d9ad2078d25a87d2dfcf3c6971f42f27399edef2c7ac93c3d","expected_protocol_fingerprint":null,"expected_record_id":null,"issued_at":"2026-09-18T23:29:19Z","kind":"ai-join-card","locator":"dial:sha256:a3bc40a37bcf607fac34ceb6990197c6cb18ff99727508293d321fbdb835a7ee","principal":{"id":"hive-hub-camera","kind":"ai"},"schema_version":1}
