{"adapter_plan":null,"card_id":"urn:hivehub:sha256:309cdbddb452a7131226322e5fd024aa768eb9f11f8f7ec18b171e2aeab5dd7e","expected_protocol_fingerprint":null,"expected_record_id":null,"issued_at":"2026-09-18T23:29:19Z","kind":"ai-join-card","locator":"dial:sha256:d8b04abbd666b800b4adef7b8fec696bfa8543e2ff5eb61f6c444d9c0dc524f4","principal":{"id":"hive-hub-camera","kind":"ai"},"schema_version":1}
