{"adapter_plan":null,"card_id":"urn:hivehub:sha256:367c80d7dc6b5e7bc2b2f23c4f4e2c8468297c2e833825846a7f9ff8f79856b4","expected_protocol_fingerprint":null,"expected_record_id":null,"issued_at":"2026-09-18T23:29:19Z","kind":"ai-join-card","locator":"dial:sha256:a31f58e0e1d7eb651b43f1e7f70882c5e0e131852177373afda53d967333cead","principal":{"id":"hive-hub-camera","kind":"ai"},"schema_version":1}
