{"adapter_plan":null,"card_id":"urn:hivehub:sha256:576fd46a961bbbeccd18825ddfce3dc511e074fd578007550ff664ca9bbef98f","expected_protocol_fingerprint":null,"expected_record_id":null,"issued_at":"2026-09-18T23:29:19Z","kind":"ai-join-card","locator":"dial:sha256:53ba73d43f2d1a8cba78211f3102fe5045a46d8f35aaec5647e46ad7db8e37d9","principal":{"id":"hive-hub-camera","kind":"ai"},"schema_version":1}
